[
  {
    "uid": "REC-SAMPLE-0001",
    "source_uid": "SRC-0101",
    "vendor_name": "Faucher",
    "source_title": "Faucher A Handles",
    "source_year": "2011-2014",
    "source_status": "Historical catalog",
    "record_status": "Unknown current status",
    "regulated_sensitive_flag": "None",
    "sector": "Business / Commercial",
    "scope": "Organizational",
    "overlay": "",
    "category_path": "Truck Body Hardware / Handles / L Handles",
    "brick_path": "Access Hardware / Handles / Locking L Handle",
    "part_number": "670-1002",
    "manufacturer_part_number": "",
    "product_name": "Locking L handle",
    "description_short": "Front-mount locking L handle with chrome finish and CH501 key.",
    "material": "",
    "dimensions": "",
    "capacity_rating": "",
    "safety_rating_or_standard": "",
    "application": "Truck body doors / compartment doors",
    "compatibility": "",
    "unit_of_measure": "Each",
    "pack_quantity": "",
    "price_original": "",
    "currency": "",
    "page_reference": "A02",
    "source_file": "Faucher_A_Handles.pdf",
    "extraction_confidence": "High",
    "copyright_handling": "Normalized facts only"
  },
  {
    "uid": "REC-SAMPLE-0002",
    "source_uid": "SRC-0101",
    "vendor_name": "Faucher",
    "source_title": "Faucher C Gas Springs & Drawer Slides",
    "source_year": "2011",
    "source_status": "Historical catalog",
    "record_status": "Unknown current status",
    "regulated_sensitive_flag": "Safety-critical mechanical support",
    "sector": "Business / Commercial",
    "scope": "Organizational",
    "overlay": "",
    "category_path": "Truck Body Hardware / Gas Springs",
    "brick_path": "Gas Springs / Without End Fittings / Series 777",
    "part_number": "777-7117",
    "manufacturer_part_number": "",
    "product_name": "Gas spring without end fittings",
    "description_short": "Series 777 gas spring; order end fittings separately.",
    "material": "",
    "dimensions": "10 mm x 22 mm body; lengths per table",
    "capacity_rating": "50 lb / 233 N force",
    "safety_rating_or_standard": "",
    "application": "Compartment door or panel support",
    "compatibility": "Ball fitting 777-7004 or eye fitting 777-9996",
    "unit_of_measure": "Each",
    "pack_quantity": "",
    "price_original": "",
    "currency": "",
    "page_reference": "C02",
    "source_file": "Faucher_C_SpringsSlides.pdf",
    "extraction_confidence": "High",
    "copyright_handling": "Normalized facts only"
  },
  {
    "uid": "REC-SAMPLE-0003",
    "source_uid": "SRC-0105",
    "vendor_name": "Grote",
    "source_title": "Grote Fuse & Circuit Protection",
    "source_year": "2016",
    "source_status": "Historical catalog",
    "record_status": "Unknown current status",
    "regulated_sensitive_flag": "Safety-critical vehicle electrical",
    "sector": "Business / Commercial",
    "scope": "Organizational",
    "overlay": "",
    "category_path": "Vehicle Electrical / Circuit Protection / Fuses",
    "brick_path": "Fuses / Blade Fuses / MINI ATM",
    "part_number": "",
    "manufacturer_part_number": "",
    "product_name": "MINI/ATM blade fuses category",
    "description_short": "Blade fuse category for vehicle circuit protection.",
    "material": "",
    "dimensions": "",
    "capacity_rating": "Amperage varies by item",
    "safety_rating_or_standard": "Application testing required",
    "application": "Vehicle overcurrent protection",
    "compatibility": "",
    "unit_of_measure": "Pack",
    "pack_quantity": "",
    "price_original": "",
    "currency": "",
    "page_reference": "Catalog section page 08",
    "source_file": "2016 - Grote Catalog - Fuse Circut Protection.pdf",
    "extraction_confidence": "Medium",
    "copyright_handling": "Category/index only"
  },
  {
    "uid": "REC-SAMPLE-0004",
    "source_uid": "SRC-0104",
    "vendor_name": "80/20 Inc.",
    "source_title": "80/20 Catalog 20",
    "source_year": "circa 2014",
    "source_status": "Historical catalog",
    "record_status": "Unknown current status",
    "regulated_sensitive_flag": "None",
    "sector": "Business / Commercial",
    "scope": "Organizational",
    "overlay": "",
    "category_path": "Modular Framing / Profiles / T-Slot Profiles",
    "brick_path": "T-Slot Aluminum / Profile",
    "part_number": "1515-UL",
    "manufacturer_part_number": "",
    "product_name": "1515-UL profile",
    "description_short": "T-slot aluminum profile referenced in catalog quick guide.",
    "material": "Aluminum",
    "dimensions": "",
    "capacity_rating": "",
    "safety_rating_or_standard": "",
    "application": "Modular machine frames, guards, workstations",
    "compatibility": "80/20 fastening system",
    "unit_of_measure": "Length",
    "pack_quantity": "",
    "price_original": "",
    "currency": "",
    "page_reference": "Quick guide references page 84",
    "source_file": "Catalog_20_20.pdf",
    "extraction_confidence": "Medium",
    "copyright_handling": "Normalized facts only"
  },
  {
    "uid": "REC-SAMPLE-0005",
    "source_uid": "SRC-0113",
    "vendor_name": "Kingfisher",
    "source_title": "Kingfisher Welded Boat Guide",
    "source_year": "2019",
    "source_status": "Historical catalog",
    "record_status": "Historical model",
    "regulated_sensitive_flag": "None",
    "sector": "Human / Consumer",
    "scope": "Personal",
    "overlay": "",
    "category_path": "Transportation / Marine Vehicles / Welded Sportfishing Boats",
    "brick_path": "Boat / Offshore / Cabin Boat",
    "part_number": "3425 GFX",
    "manufacturer_part_number": "",
    "product_name": "Offshore 3425 GFX",
    "description_short": "Large offshore welded sportfishing boat model.",
    "material": "Aluminum welded hull",
    "dimensions": "Length overall 35'1\"; beam 10'",
    "capacity_rating": "Maximum HP 900; fuel 250 USG",
    "safety_rating_or_standard": "",
    "application": "Offshore fishing/exploring",
    "compatibility": "Yamaha 425 XTO engines mentioned",
    "unit_of_measure": "Model",
    "pack_quantity": "",
    "price_original": "",
    "currency": "",
    "page_reference": "Page 3",
    "source_file": "Kingfisher_Catalogue_2019.pdf",
    "extraction_confidence": "High",
    "copyright_handling": "Normalized facts only"
  },
  {
    "uid": "REC-SAMPLE-0006",
    "source_uid": "SRC-0115",
    "vendor_name": "North by Honeywell",
    "source_title": "Respiratory Protection Catalog",
    "source_year": "2010",
    "source_status": "Historical safety catalog",
    "record_status": "Reference only unless current version verified",
    "regulated_sensitive_flag": "Safety-critical PPE",
    "sector": "Business / Commercial",
    "scope": "Organizational",
    "overlay": "Law / Rights / Regulation",
    "category_path": "Safety / PPE / Respiratory Protection",
    "brick_path": "Respirators / Air Purifying / Half Mask",
    "part_number": "7700 Series",
    "manufacturer_part_number": "",
    "product_name": "Half mask respirator family",
    "description_short": "Adaptable respirator family referenced by catalog.",
    "material": "",
    "dimensions": "",
    "capacity_rating": "",
    "safety_rating_or_standard": "Requires current safety/fit/standard verification",
    "application": "Worksite respiratory protection",
    "compatibility": "Cartridges/filters depending on hazard",
    "unit_of_measure": "Each",
    "pack_quantity": "",
    "price_original": "",
    "currency": "",
    "page_reference": "Table of contents / selection section",
    "source_file": "Respiratory_Protection_Catalog_ENG.pdf",
    "extraction_confidence": "Medium",
    "copyright_handling": "Reference/category only; no current safety advice"
  }
]